{
  "$schema": "https://json-schema.org/draft/2020-12/schema",
  "$id": "https://evemisslab.example/schemas/itr/authority-grant-v0.2.3.json",
  "title": "ITR AuthorityGrant v0.2.3",
  "type": "object",
  "additionalProperties": false,
  "required": [
    "schema_version",
    "authority_ref",
    "decision_id",
    "principal",
    "scope",
    "target",
    "issued_at",
    "expires_at",
    "max_uses",
    "revocable",
    "uses",
    "state",
    "revocation_reason"
  ],
  "properties": {
    "schema_version": {
      "const": "0.2.3"
    },
    "authority_ref": {
      "type": "string",
      "minLength": 1
    },
    "decision_id": {
      "type": "string",
      "minLength": 1
    },
    "principal": {
      "type": "string",
      "minLength": 1
    },
    "scope": {
      "type": "array",
      "items": {
        "type": "string"
      },
      "minItems": 1,
      "uniqueItems": true
    },
    "target": {
      "type": "string",
      "minLength": 1
    },
    "issued_at": {
      "type": "string",
      "format": "date-time"
    },
    "expires_at": {
      "type": "string",
      "format": "date-time"
    },
    "max_uses": {
      "type": "integer",
      "minimum": 1
    },
    "revocable": {
      "type": "boolean"
    },
    "uses": {
      "type": "integer",
      "minimum": 0
    },
    "state": {
      "enum": [
        "active",
        "consumed",
        "revoked",
        "expired"
      ]
    },
    "revocation_reason": {
      "type": [
        "string",
        "null"
      ]
    }
  }
}
